{
  "schemaVersion": 1,
  "kind": "genshinVersionTransitionBehaviorShardSnapshot",
  "generatedAt": "2026-08-26T00:00:00.000Z",
  "claim": {
    "transitionId": "genshin:6.7->7.0",
    "fromGameVersion": "6.7",
    "toGameVersion": "7.0",
    "provider": "genshin-db",
    "sourceFamily": "GenshinData-derived",
    "sourceNamespace": "genshin-db-behavior-shard07",
    "repository": "theBowja/genshin-db",
    "treeResolution": {
      "method": "nonRecursiveGitTreePath",
      "resolutionEvidence": "immutableRawPathWithEmbeddedId",
      "note": "Each captured path is a concrete entry under src/data/English/{talents,constellations}; selection is accepted only when $.id equals the explicit providerId."
    },
    "shard": {
      "shardId": "behavior:behaviorSpec:semanticDecisionRequired:standard:07",
      "queuePath": "reports/genshin-evidence-task-queue.json",
      "authoritativeCandidateCount": 100,
      "authoritativeCandidateIds": [
        "behavior:10000063:constellation:constellation-3",
        "behavior:10000063:constellation:constellation-4",
        "behavior:10000063:constellation:constellation-5",
        "behavior:10000063:constellation:constellation-6",
        "behavior:10000063:talent:burst",
        "behavior:10000063:talent:normalattack-charged",
        "behavior:10000063:talent:normalattack-normal",
        "behavior:10000063:talent:normalattack-plunging",
        "behavior:10000063:talent:passives-passive-1",
        "behavior:10000063:talent:passives-passive-2",
        "behavior:10000063:talent:passives-passive-utility",
        "behavior:10000063:talent:skill",
        "behavior:10000064:constellation:constellation-1",
        "behavior:10000064:constellation:constellation-2",
        "behavior:10000064:constellation:constellation-3",
        "behavior:10000064:constellation:constellation-4",
        "behavior:10000064:constellation:constellation-5",
        "behavior:10000064:constellation:constellation-6",
        "behavior:10000064:talent:burst",
        "behavior:10000064:talent:normalattack-charged",
        "behavior:10000064:talent:normalattack-normal",
        "behavior:10000064:talent:normalattack-plunging",
        "behavior:10000064:talent:passives-passive-1",
        "behavior:10000064:talent:passives-passive-2",
        "behavior:10000064:talent:passives-passive-utility",
        "behavior:10000064:talent:skill",
        "behavior:10000065:constellation:constellation-1",
        "behavior:10000065:constellation:constellation-2",
        "behavior:10000065:constellation:constellation-3",
        "behavior:10000065:constellation:constellation-4",
        "behavior:10000065:constellation:constellation-5",
        "behavior:10000065:constellation:constellation-6",
        "behavior:10000065:talent:burst",
        "behavior:10000065:talent:normalattack-charged",
        "behavior:10000065:talent:normalattack-normal",
        "behavior:10000065:talent:normalattack-plunging",
        "behavior:10000065:talent:passives-passive-1",
        "behavior:10000065:talent:passives-passive-2",
        "behavior:10000065:talent:passives-passive-utility",
        "behavior:10000065:talent:skill",
        "behavior:10000066:constellation:constellation-1",
        "behavior:10000066:constellation:constellation-2",
        "behavior:10000066:constellation:constellation-3",
        "behavior:10000066:constellation:constellation-4",
        "behavior:10000066:constellation:constellation-5",
        "behavior:10000066:constellation:constellation-6",
        "behavior:10000066:talent:burst",
        "behavior:10000066:talent:normalattack-charged",
        "behavior:10000066:talent:normalattack-normal",
        "behavior:10000066:talent:normalattack-plunging",
        "behavior:10000066:talent:passives-passive-1",
        "behavior:10000066:talent:passives-passive-2",
        "behavior:10000066:talent:passives-passive-utility",
        "behavior:10000066:talent:skill",
        "behavior:10000067:constellation:constellation-1",
        "behavior:10000067:constellation:constellation-2",
        "behavior:10000067:constellation:constellation-3",
        "behavior:10000067:constellation:constellation-4",
        "behavior:10000067:constellation:constellation-5",
        "behavior:10000067:constellation:constellation-6",
        "behavior:10000067:talent:burst",
        "behavior:10000067:talent:normalattack-charged",
        "behavior:10000067:talent:normalattack-normal",
        "behavior:10000067:talent:normalattack-plunging",
        "behavior:10000067:talent:passives-passive-1",
        "behavior:10000067:talent:passives-passive-2",
        "behavior:10000067:talent:passives-passive-utility",
        "behavior:10000067:talent:skill",
        "behavior:10000068:constellation:constellation-1",
        "behavior:10000068:constellation:constellation-2",
        "behavior:10000068:constellation:constellation-3",
        "behavior:10000068:constellation:constellation-4",
        "behavior:10000068:constellation:constellation-5",
        "behavior:10000068:constellation:constellation-6",
        "behavior:10000068:talent:burst",
        "behavior:10000068:talent:normalattack-charged",
        "behavior:10000068:talent:normalattack-normal",
        "behavior:10000068:talent:normalattack-plunging",
        "behavior:10000068:talent:passives-passive-1",
        "behavior:10000068:talent:passives-passive-2",
        "behavior:10000068:talent:passives-passive-utility",
        "behavior:10000068:talent:skill",
        "behavior:10000069:constellation:constellation-1",
        "behavior:10000069:constellation:constellation-2",
        "behavior:10000069:constellation:constellation-3",
        "behavior:10000069:constellation:constellation-4",
        "behavior:10000069:constellation:constellation-5",
        "behavior:10000069:constellation:constellation-6",
        "behavior:10000069:talent:burst",
        "behavior:10000069:talent:normalattack-charged",
        "behavior:10000069:talent:normalattack-normal",
        "behavior:10000069:talent:normalattack-plunging",
        "behavior:10000069:talent:passives-passive-1",
        "behavior:10000069:talent:passives-passive-2",
        "behavior:10000069:talent:passives-passive-utility",
        "behavior:10000069:talent:skill",
        "behavior:10000070:constellation:constellation-1",
        "behavior:10000070:constellation:constellation-2",
        "behavior:10000070:constellation:constellation-3",
        "behavior:10000070:constellation:constellation-4"
      ],
      "authoritativeCandidateIdsDigest": "d8d0f4ec4089a71efbf041a6ec2f7c699d97aa2d0bb25b40d122a1223fc6cf49",
      "authoritativeEntityIds": [
        "10000063",
        "10000064",
        "10000065",
        "10000066",
        "10000067",
        "10000068",
        "10000069",
        "10000070"
      ],
      "capturedNewEntityIds": [
        "10000064",
        "10000065",
        "10000066",
        "10000067",
        "10000068",
        "10000069",
        "10000070"
      ],
      "skippedOverlapEntityIds": [
        "10000063"
      ],
      "overlapPolicy": "alreadyCapturedByBehaviorShard06",
      "overlapEvidence": [
        {
          "entityId": "10000063",
          "previousShardId": "behavior:behaviorSpec:semanticDecisionRequired:standard:06",
          "acquisitionPolicy": "notReacquired"
        }
      ]
    },
    "versionBindings": [
      {
        "gameVersion": "6.7",
        "revision": "1bab2cdba4d218fd5caa46b5f54e7884ee8359a2",
        "packageVersion": "5.2.12",
        "status": "strictlyBound",
        "package": {
          "gameVersion": "6.7",
          "revision": "1bab2cdba4d218fd5caa46b5f54e7884ee8359a2",
          "packageVersion": "5.2.12",
          "path": "games/genshin/data/v2/version-transitions/6.7-to-7.0/sources/genshin-db-behavior-shard07/1bab2cdba4d218fd5caa46b5f54e7884ee8359a2/package.json",
          "url": "https://raw.githubusercontent.com/theBowja/genshin-db/1bab2cdba4d218fd5caa46b5f54e7884ee8359a2/package.json",
          "gitBlob": "e78cc92e75db21ea15edadbeafdf9152896d934c",
          "rawArtifactBytes": 1619,
          "rawArtifactSha256": "5ded2b3bab58218da17f6a1282209e653c1ec7ecd9297b95569558a737c2e8f6",
          "name": "genshin-db",
          "description": "Genshin Impact v6.7 JSON data. Search and get results in all in-game languages! Sources from the fandom wiki and GenshinData repo."
        }
      },
      {
        "gameVersion": "7.0",
        "revision": "8b15995fa220c88a4d0d7ffe1e21b041d0b32588",
        "packageVersion": "5.2.13",
        "status": "strictlyBound",
        "package": {
          "gameVersion": "7.0",
          "revision": "8b15995fa220c88a4d0d7ffe1e21b041d0b32588",
          "packageVersion": "5.2.13",
          "path": "games/genshin/data/v2/version-transitions/6.7-to-7.0/sources/genshin-db-behavior-shard07/8b15995fa220c88a4d0d7ffe1e21b041d0b32588/package.json",
          "url": "https://raw.githubusercontent.com/theBowja/genshin-db/8b15995fa220c88a4d0d7ffe1e21b041d0b32588/package.json",
          "gitBlob": "cfccefd470f420159b1376440e1a0f86a247030d",
          "rawArtifactBytes": 1619,
          "rawArtifactSha256": "3faf0b2220539a07af9260f5dd83afd0e964aa42868c9b3b73c6cb14065085c6",
          "name": "genshin-db",
          "description": "Genshin Impact v7.0 JSON data. Search and get results in all in-game languages! Sources from the fandom wiki and GenshinData repo."
        }
      }
    ],
    "resolvedEntities": [
      {
        "entityId": "10000064",
        "name": "Yun Jin",
        "nameJa": "雲菫",
        "providerSlug": "yunjin",
        "providerId": 6401,
        "resolutionStatus": "resolvedUnambiguous",
        "treeResolution": {
          "method": "nonRecursiveGitTreePath",
          "resolutionEvidence": "immutableRawPathWithEmbeddedId",
          "directoryPaths": [
            "src/data/English/talents",
            "src/data/English/constellations"
          ],